{
  "$schema": "https://json-schema.org/draft/2020-12/schema",
  "$id": "subjectkg/session-log",
  "title": "Session Log",
  "description": "One tutoring session's record. Lives at students/<id>/sessions/YYYY-MM-DD-nn.json. A log is written (including its reflection block) at session end and never edited afterwards; only a same-day /reflect pass may fill a reflection block the session left empty.",
  "type": "object",
  "required": ["student", "date", "goal", "nodes_touched", "events", "assessment", "profile_updates", "reflection"],
  "properties": {
    "student": { "type": "string" },
    "date": { "type": "string", "format": "date" },
    "duration_min": { "type": "number" },
    "goal": { "type": "string", "description": "Planned goal, as a KG node id + intent, e.g. 'g6.num.ratio-proportion: first teach'." },
    "nodes_touched": { "type": "array", "items": { "type": "string" } },
    "reviews_done": { "type": "array", "items": { "type": "string" }, "description": "Node ids reviewed at session start (spaced repetition)." },
    "events": {
      "type": "array",
      "description": "Chronological teaching moves and observations.",
      "items": {
        "type": "object",
        "required": ["type"],
        "properties": {
          "type": { "enum": ["hook", "teach", "routine", "micro-check", "question", "hint", "break", "modality-switch", "interactive", "video", "observation"] },
          "node": { "type": "string" },
          "strategy": { "type": "string", "description": "Modality or routine used." },
          "detail": { "type": "string" },
          "student_response": { "type": "string" },
          "outcome": { "enum": ["landed", "partial", "missed", "n/a"] },
          "latency_sec": { "type": "number" },
          "confidence_stated": { "type": "integer", "minimum": 1, "maximum": 5 }
        }
      }
    },
    "assessment": {
      "type": "object",
      "required": ["items"],
      "properties": {
        "items": {
          "type": "array",
          "items": {
            "type": "object",
            "required": ["node", "question", "correct"],
            "properties": {
              "node": { "type": "string" },
              "question": { "type": "string", "description": "Question id from the node bank, or 'generated:<hash>' with the item stored in generated_items." },
              "correct": { "type": "boolean" },
              "option_chosen": { "type": "string" },
              "answer_text": {
                "type": "string",
                "description": "What the student actually typed, verbatim. Present for free-text answers; absent when they picked a listed option."
              },
              "jev": {
                "type": "object",
                "description": "The model's judgment of this answer. Recorded so every derived number in profile.json is traceable to the judgment that produced it.",
                "properties": {
                  "is_correct": { "type": "number", "minimum": 0, "maximum": 1 },
                  "misconception": { "type": "string", "description": "Misconception id, or 'no_error' / 'other_error'." },
                  "misconception_confidence": { "type": "number", "minimum": 0, "maximum": 1 },
                  "depth": { "type": "number", "minimum": 0, "maximum": 2, "description": "0 slip, 1 procedural, 2 conceptual." },
                  "confident": { "type": "number", "minimum": 0, "maximum": 1 },
                  "model": { "type": "string", "description": "e.g. jev-1.13.0, so a later re-read knows which model version judged it." }
                }
              },
              "misconception_signalled": { "type": "string", "description": "Tag of the chosen distractor, if wrong." },
              "confirmed_as": { "enum": ["misconception", "slip", "unclear"], "description": "After the what-makes-you-say-that follow-up." },
              "latency_sec": { "type": "number", "description": "Only when actually measured; never estimated." },
              "confidence_stated": { "type": "integer", "minimum": 1, "maximum": 5, "description": "Student's own 1-5 sureness rating, when asked." }
            }
          }
        },
        "generated_items": { "type": "array", "items": { "type": "object" }, "description": "Full bodies of any questions generated during the session (same schema as KG node questions), so they can be reused/promoted to the bank." }
      }
    },
    "profile_updates": {
      "type": "object",
      "description": "Summary of what changed in profile.json because of this session (mastery deltas, new strategy_stats, behavior notes). Duplicated here so the profile's evolution is auditable.",
      "properties": {
        "mastery_deltas": { "type": "object", "additionalProperties": { "type": "number" } },
        "misconceptions_observed": { "type": "array", "items": { "type": "string" } },
        "misconceptions_repaired": { "type": "array", "items": { "type": "string" } },
        "strategy_outcomes": { "type": "object", "additionalProperties": { "enum": ["worked", "failed", "unclear"] } },
        "behavior_notes": { "type": "array", "items": { "type": "string" } }
      }
    },
    "reflection": {
      "type": "object",
      "required": ["goal_met", "what_worked", "what_failed", "next_time"],
      "properties": {
        "goal_met": { "type": "boolean" },
        "evidence": { "type": "string" },
        "what_worked": { "type": "array", "items": { "type": "string" } },
        "what_failed": { "type": "array", "items": { "type": "string" } },
        "surprises": { "type": "array", "items": { "type": "string" } },
        "next_time": { "type": "string", "description": "Concrete, testable plan for the next session." },
        "insight_for_ledger": { "type": "string", "description": "If a generalizable lesson emerged, the entry appended to harness/insights.md." }
      }
    }
  }
}
